{
  "run_meta": {
    "generated_at": "2026-03-23T10:06:35.978542+00:00",
    "workflow_version": "1.0.0",
    "execution_mode": "apply-fixes",
    "output_language": "en",
    "files_modified": true,
    "modification_owner": "core-workflow",
    "diff_artifacts": [
      {
        "path": "C:\\Source\\Libro.AgentWCAG.clean\\.tmp-realistic-smoke\\run\\mixed-findings.html",
        "type": "modified-file"
      },
      {
        "path": "C:\\Source\\Libro.AgentWCAG.clean\\.tmp-realistic-smoke\\run\\audit-output\\wcag-fixes.diff",
        "type": "unified-diff"
      }
    ],
    "verification_evidence": [
      {
        "finding_id": "ISSUE-001",
        "fix_id": "FIX-001",
        "type": "diff-generated",
        "status": "diff-generated",
        "target": "meta[name=\"viewport\"]"
      },
      {
        "finding_id": "ISSUE-002",
        "fix_id": "FIX-002",
        "type": "diff-generated",
        "status": "diff-generated",
        "target": "a.jump-link"
      },
      {
        "finding_id": "ISSUE-003",
        "fix_id": "FIX-003",
        "type": "diff-generated",
        "status": "diff-generated",
        "target": "img.hero"
      },
      {
        "finding_id": "ISSUE-004",
        "fix_id": "FIX-004",
        "type": "diff-generated",
        "status": "diff-generated",
        "target": "button.icon-only"
      },
      {
        "finding_id": "ISSUE-005",
        "fix_id": "FIX-005",
        "type": "diff-generated",
        "status": "diff-generated",
        "target": "ul.plain"
      }
    ],
    "tools": {
      "axe": "ok",
      "lighthouse": "ok"
    },
    "notes": [
      "Applied 5 safe auto-fix change(s) to the local target.",
      "Saved auto-fix diff: C:\\Source\\Libro.AgentWCAG.clean\\.tmp-realistic-smoke\\run\\audit-output\\wcag-fixes.diff",
      "Debt trend history reset reason: schema-version-mismatch",
      "Debt trend: new=0, accepted=0, retired=0, regressed=0 (window=5)."
    ],
    "product": {
      "name": "Libro.AgentWCAG",
      "product_version": "0.1.0",
      "version_source": "pyproject.toml",
      "source_revision": "40909dfb06f2ee93fca2b199abea26c4d7357117",
      "source_revision_source": "git-head",
      "report_schema_version": "1.0.0"
    },
    "product_version": "0.1.0",
    "source_revision": "40909dfb06f2ee93fca2b199abea26c4d7357117",
    "preflight": {
      "ok": true,
      "checks": [
        {
          "tool": "runtime",
          "status": "skipped",
          "message": "scanner tooling preflight skipped due to mock or skip flags",
          "command": "",
          "resolved_command": "",
          "version": "",
          "version_provenance": {
            "source": "skipped",
            "command": "",
            "resolved_command": "",
            "version": ""
          }
        }
      ],
      "tools": {
        "runtime": {
          "status": "skipped",
          "command": "",
          "resolved_command": "",
          "version": "",
          "message": "scanner tooling preflight skipped due to mock or skip flags",
          "version_provenance": {
            "source": "skipped",
            "command": "",
            "resolved_command": "",
            "version": ""
          }
        }
      }
    },
    "report_schema_version": "1.0.0",
    "report_schema_artifact": "C:\\Source\\Libro.AgentWCAG.clean\\.tmp-realistic-smoke\\run\\audit-output\\schemas\\wcag-report-1.0.0.schema.json",
    "retry_policy": {
      "attempts": 1,
      "initial_backoff_seconds": 0.5,
      "max_backoff_seconds": 5.0
    },
    "applied_changes": [
      {
        "rule_id": "meta-viewport",
        "changed_target": "meta[name=\"viewport\"]",
        "description": "Normalized viewport settings to an accessible value."
      },
      {
        "rule_id": "link-name",
        "changed_target": "a.jump-link",
        "description": "Added aria-label=\"Link\" to an empty link."
      },
      {
        "rule_id": "image-alt",
        "changed_target": "img.hero",
        "description": "Added an empty alt attribute to an img element missing alt text."
      },
      {
        "rule_id": "button-name",
        "changed_target": "button.icon-only",
        "description": "Added aria-label=\"Button\" to an icon-only button."
      },
      {
        "rule_id": "list",
        "changed_target": "ul.plain",
        "description": "Wrapped list content with a list item element."
      }
    ],
    "mutation_telemetry": [
      {
        "path": "C:\\Source\\Libro.AgentWCAG.clean\\.tmp-realistic-smoke\\run\\mixed-findings.html",
        "rule_id": "button-name",
        "mutation_count": 1
      },
      {
        "path": "C:\\Source\\Libro.AgentWCAG.clean\\.tmp-realistic-smoke\\run\\mixed-findings.html",
        "rule_id": "image-alt",
        "mutation_count": 1
      },
      {
        "path": "C:\\Source\\Libro.AgentWCAG.clean\\.tmp-realistic-smoke\\run\\mixed-findings.html",
        "rule_id": "link-name",
        "mutation_count": 1
      },
      {
        "path": "C:\\Source\\Libro.AgentWCAG.clean\\.tmp-realistic-smoke\\run\\mixed-findings.html",
        "rule_id": "list",
        "mutation_count": 1
      },
      {
        "path": "C:\\Source\\Libro.AgentWCAG.clean\\.tmp-realistic-smoke\\run\\mixed-findings.html",
        "rule_id": "meta-viewport",
        "mutation_count": 1
      }
    ],
    "sorting": {
      "mode": "severity",
      "deterministic": true,
      "finding_count": 15
    },
    "risk_calibration": {
      "schema_version": "1.0.0",
      "mode": "off",
      "source_path": "",
      "min_high_severity_samples": 3,
      "high_severity_precision_threshold": 0.6,
      "applied": false,
      "downgrade_reason": "mode-off",
      "rules": [],
      "unstable_high_severity_rules": [],
      "source_meta": {},
      "gate": {
        "mode": "off",
        "failed": false,
        "exit_code": 0
      }
    },
    "scanner_capabilities": {
      "scanners": {
        "axe": {
          "requested": true,
          "input_mode": "mock",
          "preflight_status": "unknown",
          "run_status": "ok",
          "available": true
        },
        "lighthouse": {
          "requested": true,
          "input_mode": "mock",
          "preflight_status": "unknown",
          "run_status": "ok",
          "available": true
        }
      },
      "available_rules": [
        "button-name",
        "heading-order",
        "image-alt",
        "link-name",
        "list",
        "meta-viewport"
      ],
      "available_rule_count": 6
    },
    "scanner_stability": {
      "schema_version": "1.0.0",
      "mode": "off",
      "artifact_path": "C:\\Source\\Libro.AgentWCAG.clean\\.tmp-realistic-smoke\\run\\audit-output\\scanner-stability.json",
      "window": 5,
      "baseline_source": "",
      "history_meta": {
        "history_reset_reason": "missing-history",
        "loaded_point_count": 0,
        "message": "--stability-baseline is not provided"
      },
      "approved_bounds": {
        "default_max_variance": 0,
        "per_signature": {}
      },
      "comparison": {
        "evaluated_signature_count": 1,
        "breach_count": 1,
        "max_delta": 1,
        "scanner_capability_changed": false,
        "previous_scanners": [],
        "current_scanners": [
          "axe",
          "lighthouse"
        ]
      },
      "gate": {
        "mode": "off",
        "evaluated": false,
        "failed": false,
        "exit_code": 0,
        "downgrade_reason": "mode-off"
      },
      "points": [
        {
          "recorded_at": "2026-03-23T10:06:36.004613Z",
          "target": "C:\\Source\\Libro.AgentWCAG.clean\\.tmp-realistic-smoke\\run\\mixed-findings.html",
          "available_scanners": [
            "axe",
            "lighthouse"
          ],
          "rows": [
            {
              "scanner": "axe",
              "rule_id": "heading-order",
              "target": "h3",
              "finding_count": 1
            }
          ]
        }
      ]
    },
    "waiver_gate": {
      "mode": "warn",
      "evaluated_count": 0,
      "expired_count": 0,
      "failed": false,
      "exit_code": 0
    },
    "debt_trend": {
      "schema_version": "1.0.0",
      "window": 5,
      "artifact_path": "C:\\Source\\Libro.AgentWCAG.clean\\.tmp-realistic-smoke\\run\\audit-output\\debt-trend.json",
      "latest_counts": {
        "new": 0,
        "accepted": 0,
        "retired": 0,
        "regressed": 0
      },
      "delta_from_previous": {
        "new": 0,
        "accepted": 0,
        "retired": 0,
        "regressed": 0
      },
      "history_meta": {
        "history_reset_reason": "schema-version-mismatch",
        "baseline_report_schema_version": "None",
        "expected_report_schema_version": "1.0.0",
        "loaded_point_count": 0
      }
    },
    "artifact_manifest": {
      "path": "C:\\Source\\Libro.AgentWCAG.clean\\.tmp-realistic-smoke\\run\\audit-output\\artifact-manifest.json",
      "algorithm": "sha256"
    }
  },
  "target": {
    "value": "C:\\Source\\Libro.AgentWCAG.clean\\.tmp-realistic-smoke\\run\\mixed-findings.html",
    "task_mode": "modify"
  },
  "standard": {
    "wcag_version": "2.2",
    "conformance_level": "AA"
  },
  "findings": [
    {
      "id": "ISSUE-002",
      "source": "lighthouse",
      "sources": [
        "lighthouse"
      ],
      "rule_id": "link-name",
      "severity": "critical",
      "confidence": "high",
      "sc": [
        "2.4.4",
        "4.1.2"
      ],
      "current": "Links have discernible text",
      "changed_target": "a.jump-link",
      "source_line": null,
      "source_column": null,
      "status": "fixed",
      "fixability": "auto-fix",
      "verification_status": "diff-generated",
      "manual_review_required": false,
      "risk_level": "high",
      "rule_family": "accessible-name",
      "downgrade_reason": null,
      "before_after_targets": [
        {
          "target": "a.jump-link",